MovieID,Title,Year,Genre,Director,Cast,Language,Country,Runtime(min),Rating,Votes,Budget(million$),Revenue(million$),Keywords,Overview,Popularity
MV1934,Women Talking: Chronicles,2011,Adventure|Fantasy|Drama,Martin Scorsese,Gene Hackman|Brad Pitt|Jennifer Lawrence|Saoirse Ronan|Tom Hanks,Korean,Canada,172,8.7,864079,22.1,74.5,revenge|dystopia|justice|discovery|supernatural|friendship,A adventure film directed by Martin Scorsese featuring Gene Hackman.,40.86
MV1935,The Returns of Glass,1995,Fantasy,Clint Eastwood,Tom Hanks|Zendaya|Natalie Portman,Italian,Australia,77,8.3,2433686,173.9,1274.8,time travel|love|danger|identity|redemption,A fantasy film directed by Clint Eastwood featuring Tom Hanks.,25.72
MV1936,The Menu: Void,2011,Romance|Fantasy,Sofia Coppola,Austin Butler|Andrew Garfield|Jake Gyllenhaal|Al Pacino|Jack Nicholson,Spanish,South Korea,194,5.8,22827,294.4,1205.6,ambition|corruption|danger|dystopia,A romance film directed by Sofia Coppola featuring Austin Butler.,69.55
MV1937,The Redemption of Mank,1993,Biography|Drama|Crime,Tim Burton,Emma Stone|Joaquin Phoenix|Austin Butler,Spanish,South Korea,184,6.7,2353139,318.2,1437.7,redemption|loss|escape|time travel|dystopia|family,A biography film directed by Tim Burton featuring Emma Stone.,95.33
MV1938,Barbarian: Legacy,2006,Musical|Biography,Peter Jackson,Adam Driver|Florence Pugh|Margot Robbie|Natalie Portman|Michael Fassbender,Korean,India,97,4.7,1680083,80.6,,betrayal|escape|freedom|sacrifice|loss,A musical film directed by Peter Jackson featuring Adam Driver.,4.69
MV1939,American Beauty: Spark,1985,Animation|Comedy,Sofia Coppola,Joaquin Phoenix|Emma Stone|Jessica Chastain,French,UK,181,7.0,497029,36.6,120.0,redemption|loss|survival,A animation film directed by Sofia Coppola featuring Joaquin Phoenix.,9.84
MV1940,The Returns of Spencer,1997,Horror|Romance,Ridley Scott,Michael Fassbender|Ana de Armas|Viola Davis|Jessica Chastain|Idris Elba,Korean,India,190,4.5,1120532,282.6,,time travel|heist|corruption|friendship|escape,A horror film directed by Ridley Scott featuring Michael Fassbender.,36.06
MV1941,The Untold of Women,2006,Comedy|Musical|Animation,Akira Kurosawa,Ryan Gosling|Austin Butler|Jessica Chastain,Hindi,Japan,107,7.8,1867552,260.6,1689.3,based on true story|ambition|mystery|danger|justice|heist,A comedy film directed by Akira Kurosawa featuring Ryan Gosling.,78.82
MV1942,Tár: Infinity,1992,Action|Biography,Billy Wilder,Anya Taylor-Joy|Robert De Niro|Lupita Nyong'o|Mark Ruffalo|Meryl Streep,Mandarin,UK,92,5.0,1089932,299.8,1829.6,mystery|friendship|dystopia,A action film directed by Billy Wilder featuring Anya Taylor-Joy.,53.24
MV1943,Women Talking: Horizon,2024,Comedy|Biography,Ron Howard,Benedict Cumberbatch|Gene Hackman|Anya Taylor-Joy|Matt Damon|Joaquin Phoenix,Spanish,Canada,165,5.4,1625025,150.3,426.2,dystopia|survival|supernatural|coming of age,A comedy film directed by Ron Howard featuring Benedict Cumberbatch.,69.97
MV1944,The Untold of Uncut,1980,Drama,Tim Burton,Cate Blanchett|Jack Nicholson|Saoirse Ronan|Emma Stone|Margot Robbie,Japanese,India,147,7.8,1338665,205.2,431.7,dystopia|identity|conspiracy,A drama film directed by Tim Burton featuring Cate Blanchett.,22.07
MV1945,The Destiny of Drive,2023,History|Action|Musical,Martin Scorsese,Leonardo DiCaprio|Timothée Chalamet|Andrew Garfield|Natalie Portman,Spanish,Canada,147,7.5,1418007,157.5,1201.8,love|friendship|coming of age|escape,A history film directed by Martin Scorsese featuring Leonardo DiCaprio.,30.87
MV1946,Joker: Origins,1995,Fantasy|Horror,Akira Kurosawa,Paul Mescal|Jake Gyllenhaal|Dustin Hoffman,Korean,India,118,7.7,1980174,249.8,1728.0,escape|danger|war|heist|redemption|love,A fantasy film directed by Akira Kurosawa featuring Paul Mescal.,91.91
MV1947,No Country for Old Men: Prophecy,1985,Adventure|Musical,James Cameron,Cate Blanchett|Austin Butler|Timothée Chalamet|Meryl Streep|Denzel Washington,Japanese,UK,75,6.7,2420516,43.2,341.9,survival|power|loss,A adventure film directed by James Cameron featuring Cate Blanchett.,26.52
MV1948,Minari: Horizon,2016,Horror|Biography,Wes Anderson,Joaquin Phoenix|Zendaya|Emma Stone,Mandarin,Australia,161,9.3,775791,85.2,681.6,power|danger|heist|supernatural|sacrifice|freedom,A horror film directed by Wes Anderson featuring Joaquin Phoenix.,1.47
MV1949,The Departed: Rising,1986,Drama,Akira Kurosawa,Andrew Garfield|Tom Hanks|Christian Bale|Michael Fassbender|Florence Pugh,English,Canada,179,7.7,1728779,255.1,368.0,justice|supernatural|redemption|danger|coming of age|escape,A drama film directed by Akira Kurosawa featuring Andrew Garfield.,65.01
MV1950,There Will Be Blood: Uprising,1986,Action|History|Musical,David Fincher,Florence Pugh|Leonardo DiCaprio|Daniel Craig|Tom Hanks|Saoirse Ronan,English,South Korea,199,6.9,255890,185.2,785.9,conspiracy|dystopia|coming of age|identity|escape|mystery,A action film directed by David Fincher featuring Florence Pugh.,17.26
MV1951,Joker: Unleashed,1995,Adventure|Romance,Francis Ford Coppola,Adam Driver|Zendaya|Joaquin Phoenix,Mandarin,India,179,9.1,739207,215.9,642.7,based on true story|power|heist|friendship|corruption|loss,A adventure film directed by Francis Ford Coppola featuring Adam Driver.,32.35
MV1952,The Legacy of CODA,2012,Animation,Kathryn Bigelow,Zendaya|Florence Pugh|Anya Taylor-Joy|Charlize Theron,English,USA,124,5.7,556228,264.4,203.5,betrayal|loss|discovery|mystery|love|redemption,A animation film directed by Kathryn Bigelow featuring Zendaya.,13.38
MV1953,Goodfellas: Horizon,2008,Thriller,Christopher Nolan,Meryl Streep|Timothée Chalamet|Idris Elba|Jessica Chastain|Ryan Gosling,Italian,UK,185,6.8,616043,226.9,542.9,supernatural|sacrifice|justice|war|family|corruption,A thriller film directed by Christopher Nolan featuring Meryl Streep.,71.1
MV1954,Dune: Reborn,1993,Fantasy|Biography,Tim Burton,Emma Stone|Jake Gyllenhaal|Scarlett Johansson|Zendaya|Adam Driver,Korean,South Korea,141,4.7,2235684,330.3,1872.2,coming of age|ambition|mystery|freedom,A fantasy film directed by Tim Burton featuring Emma Stone.,14.84
MV1955,The Fallen of Inception,1993,Action,Denis Villeneuve,Florence Pugh|Brad Pitt|Leonardo DiCaprio,Mandarin,Canada,154,4.8,871805,88.6,637.9,supernatural|freedom|revenge|friendship,A action film directed by Denis Villeneuve featuring Florence Pugh.,20.55
MV1956,The Unleashed of Forrest,1993,Romance|Horror|Sci-Fi,Stanley Kubrick,Scarlett Johansson|Mark Ruffalo|Jack Nicholson,Hindi,Australia,78,5.5,920058,,751.1,coming of age|heist|war|sacrifice|identity,A romance film directed by Stanley Kubrick featuring Scarlett Johansson.,57.57
MV1957,Tenet: Uprising,2002,Romance|Fantasy,Federico Fellini,Morgan Freeman|Natalie Portman|Mark Ruffalo|Zendaya|Gene Hackman,Mandarin,South Korea,193,7.4,660940,152.8,81.3,conspiracy|family|time travel|dystopia,A romance film directed by Federico Fellini featuring Morgan Freeman.,45.58
MV1958,Tenet: Legacy,1988,Adventure|Thriller|Mystery,Ingmar Bergman,Meryl Streep|Ryan Gosling|Denzel Washington|Timothée Chalamet|Al Pacino,Hindi,Australia,130,7.7,337813,243.0,115.7,war|discovery|ambition|justice,A adventure film directed by Ingmar Bergman featuring Meryl Streep.,76.0
MV1959,Memoria: Legacy,1981,Horror,Christopher Nolan,Adam Driver|Jack Nicholson|Austin Butler|Michael Fassbender,,Germany,192,5.2,1249494,173.5,681.3,dystopia|escape|heist|danger|identity,A horror film directed by Christopher Nolan featuring Adam Driver.,25.41
MV1960,Tenet: Spark,1991,Comedy|History,Ron Howard,Christian Bale|Morgan Freeman|Natalie Portman|Jennifer Lawrence,Italian,Canada,177,5.3,1853901,103.9,489.4,mystery|discovery|based on true story|friendship|coming of age|corruption,A comedy film directed by Ron Howard featuring Christian Bale.,91.78
MV1961,The Green Mile: Eclipse,2007,Mystery|Horror|Thriller,Martin Scorsese,Brad Pitt|Ana de Armas|Zendaya|Emma Stone,English,USA,113,8.1,382848,6.5,9.3,redemption|loss|heist|based on true story|mystery|coming of age,A mystery film directed by Martin Scorsese featuring Brad Pitt.,74.55
MV1962,The Horizon of Belfast,1990,Thriller|Romance|Adventure,Clint Eastwood,Anya Taylor-Joy|Emma Stone|Denzel Washington|Cate Blanchett,German,Germany,,8.4,2434788,44.2,218.6,danger|ambition|identity|loss|supernatural,A thriller film directed by Clint Eastwood featuring Anya Taylor-Joy.,97.05
MV1963,The Fallen of American,2008,Musical|Crime|Mystery,Billy Wilder,Gene Hackman|Florence Pugh|Ana de Armas,Italian,Canada,167,7.5,1172859,32.9,261.1,based on true story|dystopia|discovery,A musical film directed by Billy Wilder featuring Gene Hackman.,67.42
MV1964,The Dominion of American,2022,Mystery|Adventure,Quentin Tarantino,Tom Hardy|Charlize Theron|Zendaya,Korean,Japan,182,6.4,2411250,292.6,662.2,based on true story|redemption|conspiracy|mystery|danger|freedom,A mystery film directed by Quentin Tarantino featuring Tom Hardy.,77.04
MV1965,The Legacy of Everything,2016,Mystery,Alfonso Cuaron,Adam Driver|Charlize Theron|Robert De Niro|Andrew Garfield,Korean,India,152,8.1,1857158,32.6,142.5,freedom|friendship|mystery|dystopia,A mystery film directed by Alfonso Cuaron featuring Adam Driver.,27.14
MV1966,The Green Mile: Destiny,2000,Comedy,Denis Villeneuve,Ana de Armas|Anya Taylor-Joy|Jack Nicholson,German,Japan,175,8.4,694736,93.6,188.3,justice|friendship|ambition|loss,A comedy film directed by Denis Villeneuve featuring Ana de Armas.,59.89
MV1967,The Prophecy of Minari,2012,Drama|Action,Ang Lee,Meryl Streep|Emma Stone|Benedict Cumberbatch|Joaquin Phoenix|Lupita Nyong'o,Japanese,Germany,184,4.0,1257843,206.0,154.7,loss|friendship|freedom|based on true story|coming of age|identity,A drama film directed by Ang Lee featuring Meryl Streep.,73.73
MV1968,Birdman: Chaos,2001,Biography,Denis Villeneuve,Anya Taylor-Joy|Michael Fassbender|Jennifer Lawrence|Charlize Theron|Andrew Garfield,German,Australia,92,7.5,187287,15.8,105.5,corruption|ambition|discovery,,22.94
MV1969,Tár: Void,1994,Horror|Musical|Fantasy,Christopher Nolan,Christian Bale|Daniel Craig|Benedict Cumberbatch,Hindi,South Korea,207,4.1,131722,24.9,171.5,freedom|war|danger|survival|justice,A horror film directed by Christopher Nolan featuring Christian Bale.,56.33
MV1970,The Infinity of Minari,1987,Musical,Guillermo del Toro,Mark Ruffalo|Meryl Streep|Charlize Theron|Benedict Cumberbatch|Matt Damon,French,Canada,131,8.6,2418547,144.7,531.4,based on true story|heist|sacrifice|survival|coming of age|revenge,A musical film directed by Guillermo del Toro featuring Mark Ruffalo.,54.09
MV1971,The Departed: Fallen,2015,Biography|History|Horror,Christopher Nolan,Natalie Portman|Denzel Washington|Adam Driver|Robert De Niro,Spanish,Canada,131,5.1,590287,26.9,48.4,betrayal|family|love|escape|coming of age,A biography film directed by Christopher Nolan featuring Natalie Portman.,81.03
MV1972,Dune: Redemption,2010,Horror|Adventure,Sofia Coppola,Jessica Chastain|Morgan Freeman|Saoirse Ronan|Idris Elba,Mandarin,USA,174,6.2,287442,242.0,1742.8,identity|based on true story|supernatural|family,A horror film directed by Sofia Coppola featuring Jessica Chastain.,72.36
MV1973,The Origins of Everything,2007,Animation|Mystery,Martin Scorsese,Matt Damon|Andrew Garfield|Adam Driver,English,UK,95,8.9,553640,302.4,1745.0,heist|discovery|mystery|redemption,A animation film directed by Martin Scorsese featuring Matt Damon.,6.87
MV1974,American Beauty: Order,1983,Biography|Comedy,Denis Villeneuve,Tom Hardy|Gene Hackman|Benedict Cumberbatch,German,Australia,204,7.9,443312,296.2,2099.3,time travel|war|escape|loss|danger|love,A biography film directed by Denis Villeneuve featuring Tom Hardy.,96.72
MV1975,Gladiator: Eclipse,2007,Adventure,Quentin Tarantino,Margot Robbie|Natalie Portman|Andrew Garfield|Leonardo DiCaprio,Japanese,Japan,179,8.6,2270602,245.8,1383.1,war|friendship|love|danger|mystery|based on true story,A adventure film directed by Quentin Tarantino featuring Margot Robbie.,43.06
MV1976,Saving Private Ryan: Nexus,2001,Action|Sci-Fi|Comedy,Billy Wilder,Idris Elba|Benedict Cumberbatch|Michael Fassbender|Adam Driver,Mandarin,South Korea,164,7.1,171379,171.0,237.8,survival|power|family|heist|discovery,A action film directed by Billy Wilder featuring Idris Elba.,66.13
MV1977,The Beyond of CODA,2000,Mystery,Akira Kurosawa,Paul Mescal|Tom Hardy|Timothée Chalamet|Michael Fassbender|Jessica Chastain,French,Canada,163,5.1,402504,137.4,947.6,sacrifice|family|ambition|time travel|loss,,13.22
MV1978,A Beautiful Mind: Order,2023,Comedy|Crime,Ingmar Bergman,Jessica Chastain|Robert De Niro|Matt Damon|Scarlett Johansson,Mandarin,Germany,186,4.0,796411,108.6,469.2,based on true story|loss|danger|discovery|time travel,A comedy film directed by Ingmar Bergman featuring Jessica Chastain.,99.79
MV1979,The Nexus of 1917,2011,Romance|Action|Comedy,Martin Scorsese,Zendaya|Scarlett Johansson|Emma Stone|Robert De Niro,Spanish,Italy,112,5.5,852775,119.7,350.7,dystopia|love|revenge|ambition|corruption|supernatural,A romance film directed by Martin Scorsese featuring Zendaya.,83.93
MV1980,The Fallen of Dune,2001,Action,Stanley Kubrick,Ryan Gosling|Benedict Cumberbatch|Jake Gyllenhaal|Robert De Niro,Korean,UK,206,5.5,1736220,6.8,,power|heist|family|mystery,A action film directed by Stanley Kubrick featuring Ryan Gosling.,15.79
MV1981,Spencer: Reborn,1997,Musical|Fantasy,Denis Villeneuve,Natalie Portman|Margot Robbie|Jack Nicholson|Cate Blanchett|Tom Hanks,Mandarin,India,206,5.2,826583,238.6,1238.5,escape|coming of age|danger|family|conspiracy|power,A musical film directed by Denis Villeneuve featuring Natalie Portman.,5.47
MV1982,Minari: Redemption,2019,History|Mystery|Fantasy,Ang Lee,Ana de Armas|Natalie Portman|Jack Nicholson,English,USA,173,4.8,1304305,57.8,199.1,ambition|coming of age|discovery|identity|redemption|heist,A history film directed by Ang Lee featuring Ana de Armas.,33.92
MV1983,The Infinity of Aftersun,1993,Romance|Adventure|History,Sofia Coppola,Jake Gyllenhaal|Zendaya|Dustin Hoffman,Spanish,Italy,154,5.6,779795,,127.3,war|survival|freedom|ambition|heist,A romance film directed by Sofia Coppola featuring Jake Gyllenhaal.,56.15
MV1984,Drive My Car: Spark,2013,Adventure,Ron Howard,Leonardo DiCaprio|Idris Elba|Saoirse Ronan,German,India,186,6.1,1590069,248.3,1092.2,power|corruption|conspiracy|coming of age|ambition|freedom,A adventure film directed by Ron Howard featuring Leonardo DiCaprio.,8.82
MV1985,Minari: Phantom,2004,Horror|Crime|Thriller,Quentin Tarantino,Scarlett Johansson|Michael Fassbender|Natalie Portman|Gene Hackman,English,India,150,7.9,345769,90.7,694.0,revenge|time travel|dystopia|war,A horror film directed by Quentin Tarantino featuring Scarlett Johansson.,2.51
MV1986,The Reckoning of Spencer,1999,Fantasy|Animation,Wes Anderson,Emma Stone|Cate Blanchett|Denzel Washington|Al Pacino,Hindi,UK,106,7.8,1521118,,,based on true story|escape|freedom|betrayal|discovery,A fantasy film directed by Wes Anderson featuring Emma Stone.,43.78
MV1987,The Power of the Dog: Nexus,1994,Romance|Crime,Francis Ford Coppola,Mark Ruffalo|Paul Mescal|Charlize Theron|Andrew Garfield,German,UK,210,6.9,388219,293.4,1163.8,love|conspiracy|family|war|justice|escape,A romance film directed by Francis Ford Coppola featuring Mark Ruffalo.,59.49
MV1988,Titane: Untold,1998,History|Action|Thriller,David Fincher,Christian Bale|Amy Adams|Ryan Gosling,Italian,Japan,85,9.1,1842181,5.8,21.9,power|supernatural|ambition,,22.62
MV1989,The Chronicles of Joker,1981,Sci-Fi,Guillermo del Toro,Charlize Theron|Michael Fassbender|Leonardo DiCaprio|Saoirse Ronan,German,France,116,8.7,2306291,298.5,365.7,based on true story|heist|time travel|danger,A sci-fi film directed by Guillermo del Toro featuring Charlize Theron.,13.58
MV1990,Se7en: Origins,2010,Biography|Romance|Musical,Clint Eastwood,Adam Driver|Idris Elba|Emma Stone,Korean,South Korea,77,9.0,1511591,225.7,1802.6,escape|betrayal|heist|love|loss|conspiracy,A biography film directed by Clint Eastwood featuring Adam Driver.,66.35
MV1991,Knives Out: Uprising,2021,Thriller|Horror,Ang Lee,Margot Robbie|Daniel Craig|Andrew Garfield|Robert De Niro|Matt Damon,Mandarin,Japan,185,5.9,647007,338.4,574.0,loss|supernatural|mystery,A thriller film directed by Ang Lee featuring Margot Robbie.,47.3
MV1992,The Origins of Mank,2004,Mystery|Adventure,Quentin Tarantino,Lupita Nyong'o|Benedict Cumberbatch|Daniel Craig,Italian,Italy,170,7.1,1083168,59.3,302.1,escape|coming of age|redemption|war|based on true story|identity,A mystery film directed by Quentin Tarantino featuring Lupita Nyong'o.,20.15
MV1993,The Rising of There,2010,Horror|Crime,David Fincher,Andrew Garfield|Adam Driver|Cate Blanchett|Emma Stone,Japanese,UK,199,5.4,2499191,26.5,78.6,danger|time travel|based on true story,A horror film directed by David Fincher featuring Andrew Garfield.,30.48
MV1994,A Beautiful Mind: Dominion,2011,Drama|Horror,Jean-Luc Godard,Meryl Streep|Natalie Portman|Cate Blanchett,French,South Korea,102,5.8,2205902,338.5,903.9,supernatural|redemption|identity|friendship,A drama film directed by Jean-Luc Godard featuring Meryl Streep.,50.44
MV1995,Forrest Gump: Chronicles,2013,Drama|Biography,Guillermo del Toro,Timothée Chalamet|Denzel Washington|Tom Hanks|Joaquin Phoenix,French,Italy,198,5.2,113244,134.1,673.3,freedom|heist|mystery|loss|dystopia|betrayal,A drama film directed by Guillermo del Toro featuring Timothée Chalamet.,97.8
MV1996,The Reborn of Licorice,1999,Mystery,Ridley Scott,Mark Ruffalo|Ana de Armas|Jessica Chastain,Hindi,France,143,9.0,1968013,37.1,252.3,justice|heist|freedom|discovery|redemption,A mystery film directed by Ridley Scott featuring Mark Ruffalo.,16.54
MV1997,No Country for Old Men: Revolution,2009,Animation|Thriller|Mystery,Ingmar Bergman,Lupita Nyong'o|Leonardo DiCaprio|Daniel Craig,German,Australia,162,6.2,2315520,241.1,1682.8,coming of age|survival|love|ambition|corruption|heist,A animation film directed by Ingmar Bergman featuring Lupita Nyong'o.,60.89
MV1998,The Redemption of Knives,2017,History|Thriller,Billy Wilder,Lupita Nyong'o|Margot Robbie|Zendaya,English,France,172,5.1,2056218,139.1,569.5,based on true story|coming of age|justice|discovery|loss|friendship,A history film directed by Billy Wilder featuring Lupita Nyong'o.,73.8
MV1999,The Godfather: Revolution,2008,Drama|Horror|History,Federico Fellini,Viola Davis|Margot Robbie|Saoirse Ronan|Idris Elba|Jennifer Lawrence,English,France,139,4.1,1530011,85.2,350.4,danger|supernatural|friendship,A drama film directed by Federico Fellini featuring Viola Davis.,68.24
MV2000,The Godfather: Nexus,1981,Animation,Ingmar Bergman,Margot Robbie|Andrew Garfield|Meryl Streep|Florence Pugh,Mandarin,USA,170,5.3,906601,70.4,310.4,escape|redemption|betrayal|supernatural|discovery|war,A animation film directed by Ingmar Bergman featuring Margot Robbie.,25.52
MV2001,The Destiny of Barbarian,1981,Thriller|Animation,David Fincher,Margot Robbie|Robert De Niro|Charlize Theron,English,Germany,130,5.0,1081317,293.6,798.5,based on true story|supernatural|family,A thriller film directed by David Fincher featuring Margot Robbie.,41.35
MV2002,The Uprising of Saving,2005,Romance|Mystery,Tim Burton,Michael Fassbender|Adam Driver|Meryl Streep|Viola Davis,Korean,France,199,5.1,2393331,217.1,507.2,discovery|family|based on true story|love|conspiracy,A romance film directed by Tim Burton featuring Michael Fassbender.,95.54
MV2003,Saving Private Ryan: Unleashed,2007,Animation,Ingmar Bergman,Matt Damon|Denzel Washington|Jennifer Lawrence|Michael Fassbender|Joaquin Phoenix,Mandarin,Japan,193,6.6,1969523,71.6,129.7,dystopia|revenge|identity|survival,A animation film directed by Ingmar Bergman featuring Matt Damon.,27.09
MV2004,The Horizon of Joker,2017,History,Alfonso Cuaron,Charlize Theron|Gene Hackman|Jack Nicholson,Spanish,Germany,83,5.0,1961175,11.1,37.8,corruption|identity|coming of age|sacrifice|love|supernatural,A history film directed by Alfonso Cuaron featuring Charlize Theron.,9.43
MV2005,The Spark of Promising,2005,History,David Fincher,Matt Damon|Scarlett Johansson|Jake Gyllenhaal|Zendaya|Timothée Chalamet,Japanese,Italy,208,9.3,430723,245.3,1898.2,sacrifice|identity|ambition|freedom,A history film directed by David Fincher featuring Matt Damon.,1.89
MV2006,The Dominion of Judas,2005,Horror|Drama|Action,Federico Fellini,Margot Robbie|Meryl Streep|Zendaya|Timothée Chalamet,Mandarin,South Korea,152,6.4,1128867,179.8,325.7,mystery|friendship|ambition,A horror film directed by Federico Fellini featuring Margot Robbie.,84.3
MV2007,Titane: Infinity,1998,Crime|Comedy,Ron Howard,Ana de Armas|Brad Pitt|Al Pacino,English,South Korea,105,8.8,2324984,304.3,1277.0,based on true story|friendship|mystery|supernatural|survival|identity,A crime film directed by Ron Howard featuring Ana de Armas.,49.75
MV2008,The Phantom of Knives,1982,Adventure|Mystery|Crime,Wong Kar-wai,Daniel Craig|Emma Stone|Tom Hanks|Jake Gyllenhaal,Spanish,USA,193,7.4,1560201,153.1,1041.8,family|identity|discovery|coming of age|love,A adventure film directed by Wong Kar-wai featuring Daniel Craig.,13.3
MV2009,The Prophecy of Birdman,2022,Sci-Fi|Musical|Thriller,Denis Villeneuve,Denzel Washington|Christian Bale|Viola Davis,Italian,Germany,165,5.5,14493,342.5,180.2,based on true story|justice|friendship,A sci-fi film directed by Denis Villeneuve featuring Denzel Washington.,80.7
MV2010,The Prophecy of Marriage,2020,Horror|Thriller|Drama,Sofia Coppola,Leonardo DiCaprio|Tom Hanks|Tom Hardy|Scarlett Johansson,Korean,UK,110,7.8,1613749,326.7,415.8,power|ambition|war,A horror film directed by Sofia Coppola featuring Leonardo DiCaprio.,78.39
MV2011,Belfast: Infinity,2008,Musical,Ang Lee,Saoirse Ronan|Zendaya|Denzel Washington|Emma Stone,Mandarin,France,144,8.6,1383057,223.7,631.1,justice|survival|danger,A musical film directed by Ang Lee featuring Saoirse Ronan.,16.52
MV2012,The Reborn of Belfast,1988,Horror|History|Drama,Ang Lee,Amy Adams|Mark Ruffalo|Jack Nicholson|Timothée Chalamet,German,Australia,209,7.6,333464,118.5,344.4,mystery|love|ambition,A horror film directed by Ang Lee featuring Amy Adams.,13.27
MV2013,The Infinity of Whiplash,2009,Drama|Mystery,Ingmar Bergman,Leonardo DiCaprio|Tom Hardy|Ana de Armas|Andrew Garfield,Japanese,Canada,104,8.9,1365575,258.2,,time travel|friendship|power|identity,A drama film directed by Ingmar Bergman featuring Leonardo DiCaprio.,71.47
MV2014,Birdman: Dominion,2002,Crime|Fantasy,Ingmar Bergman,Mark Ruffalo|Benedict Cumberbatch|Ana de Armas,Mandarin,UK,90,6.8,563474,232.8,870.5,power|freedom|coming of age|dystopia|time travel,A crime film directed by Ingmar Bergman featuring Mark Ruffalo.,50.17
MV2015,Ford v Ferrari: Phantom,1993,Animation|Comedy|Romance,John Ford,Viola Davis|Florence Pugh|Denzel Washington|Al Pacino|Meryl Streep,English,India,90,7.9,1389037,312.6,1537.6,danger|dystopia|power|escape|conspiracy,A animation film directed by John Ford featuring Viola Davis.,73.98
MV2016,Glass Onion: Phantom,2023,Horror|Biography|Sci-Fi,Woody Allen,Matt Damon|Morgan Freeman|Benedict Cumberbatch|Mark Ruffalo,Korean,Italy,82,9.1,1890127,151.4,352.6,loss|power|war,A horror film directed by Woody Allen featuring Matt Damon.,78.44
MV2017,The Reborn of A,1984,History|Horror,Quentin Tarantino,Dustin Hoffman|Jake Gyllenhaal|Margot Robbie|Natalie Portman|Zendaya,English,USA,161,5.6,1529979,118.4,254.9,justice|discovery|corruption|dystopia|identity,A history film directed by Quentin Tarantino featuring Dustin Hoffman.,80.34
MV2018,The Fabelmans: Revolution,2022,Fantasy|History,Akira Kurosawa,Lupita Nyong'o|Ana de Armas|Brad Pitt|Andrew Garfield,Italian,USA,152,9.4,2435915,33.0,137.6,power|redemption|survival,A fantasy film directed by Akira Kurosawa featuring Lupita Nyong'o.,47.89
MV2019,The Reborn of Ford,2017,Crime|Thriller,Denis Villeneuve,Andrew Garfield|Jessica Chastain|Meryl Streep|Al Pacino,Korean,UK,182,4.2,2415886,334.5,2375.6,time travel|heist|revenge|survival|love,A crime film directed by Denis Villeneuve featuring Andrew Garfield.,37.49
MV2020,Birdman: Uprising,1982,Sci-Fi,Wes Anderson,Meryl Streep|Al Pacino|Jake Gyllenhaal,Korean,South Korea,185,5.3,2464883,15.9,116.1,danger|time travel|freedom|ambition,A sci-fi film directed by Wes Anderson featuring Meryl Streep.,17.79
MV2021,Ford v Ferrari: Dominion,2008,Drama|Biography|History,Tim Burton,Adam Driver|Michael Fassbender|Viola Davis|Margot Robbie,Spanish,USA,134,5.6,389833,65.8,114.2,identity|power|sacrifice|friendship|family|dystopia,A drama film directed by Tim Burton featuring Adam Driver.,31.39
MV2022,1917: Infinity,2011,History|Sci-Fi|Musical,Denis Villeneuve,Denzel Washington|Jack Nicholson|Jennifer Lawrence|Austin Butler,French,Australia,196,6.4,1269159,96.1,448.0,loss|ambition|freedom|heist|survival,A history film directed by Denis Villeneuve featuring Denzel Washington.,31.29
MV2023,The Unleashed of Ford,1995,Biography,Alfonso Cuaron,Adam Driver|Michael Fassbender|Joaquin Phoenix|Jack Nicholson,Spanish,South Korea,146,4.1,641035,219.7,1406.1,danger|escape|based on true story,A biography film directed by Alfonso Cuaron featuring Adam Driver.,38.13
MV2024,The Dark Knight: Chaos,1987,Adventure|Comedy|History,Kathryn Bigelow,Viola Davis|Gene Hackman|Jack Nicholson,Spanish,Japan,173,7.1,577175,65.8,46.3,redemption|mystery|sacrifice|conspiracy|danger|friendship,A adventure film directed by Kathryn Bigelow featuring Viola Davis.,6.27
MV2025,The Returns of A,2013,Animation|Adventure,Denis Villeneuve,Idris Elba|Benedict Cumberbatch|Jennifer Lawrence,German,Italy,190,7.6,1560609,289.2,1111.9,danger|heist|revenge|love|justice|corruption,A animation film directed by Denis Villeneuve featuring Idris Elba.,7.64
MV2026,The Fallen of Uncut,2018,Thriller|Sci-Fi,Denis Villeneuve,Timothée Chalamet|Meryl Streep|Mark Ruffalo,German,UK,140,9.3,1490530,68.3,152.7,betrayal|love|power|family|survival,A thriller film directed by Denis Villeneuve featuring Timothée Chalamet.,98.09
