MovieID,Title,Year,Genre,Director,Cast,Language,Country,Runtime(min),Rating,Votes,Budget(million$),Revenue(million$),Keywords,Overview,Popularity
MV1468,The Legacy of Promising,1990,Action|Drama|Crime,Jean-Luc Godard,Zendaya|Natalie Portman|Scarlett Johansson|Gene Hackman|Robert De Niro,Spanish,Japan,93,9.2,2398353,86.0,500.2,freedom|danger|escape|time travel|dystopia|loss,A action film directed by Jean-Luc Godard featuring Zendaya.,4.6
MV1469,The Reign of Belfast,2018,Comedy,Clint Eastwood,Jessica Chastain|Tom Hanks|Timothée Chalamet|Benedict Cumberbatch|Anya Taylor-Joy,Mandarin,Australia,196,7.6,1764103,124.0,839.9,time travel|heist|escape|conspiracy,A comedy film directed by Clint Eastwood featuring Jessica Chastain.,69.6
MV1470,The Destiny of Braveheart,2012,Fantasy|Biography|Crime,Stanley Kubrick,Amy Adams|Ryan Gosling|Matt Damon|Morgan Freeman,English,France,105,,1477281,294.9,1847.4,based on true story|loss|friendship|power|escape|time travel,A fantasy film directed by Stanley Kubrick featuring Amy Adams.,46.15
MV1471,The Godfather: Eternal,2005,Romance|Adventure,Woody Allen,Zendaya|Michael Fassbender|Joaquin Phoenix|Anya Taylor-Joy,Hindi,Canada,190,9.1,374405,147.5,272.9,identity|conspiracy|love|friendship|corruption,A romance film directed by Woody Allen featuring Zendaya.,4.27
MV1472,Drive My Car: Fallen,1997,Sci-Fi|Crime|Comedy,Clint Eastwood,Robert De Niro|Matt Damon|Dustin Hoffman|Anya Taylor-Joy,Italian,France,172,5.2,864559,18.3,57.8,supernatural|revenge|betrayal|justice|dystopia|war,A sci-fi film directed by Clint Eastwood featuring Robert De Niro.,16.99
MV1473,Interstellar: Untold,2019,Musical|Adventure,Francis Ford Coppola,Anya Taylor-Joy|Benedict Cumberbatch|Al Pacino|Michael Fassbender|Charlize Theron,Japanese,Germany,186,5.4,1386829,264.0,1857.2,supernatural|mystery|power|conspiracy|friendship,A musical film directed by Francis Ford Coppola featuring Anya Taylor-Joy.,78.77
MV1474,The Reckoning of A,2018,History,Billy Wilder,Margot Robbie|Daniel Craig|Saoirse Ronan|Tom Hardy,Korean,Canada,144,8.8,1107433,7.0,43.0,family|mystery|love|escape,A history film directed by Billy Wilder featuring Margot Robbie.,33.49
MV1475,Goodfellas: Origins,2014,Biography|Adventure|Crime,Jean-Luc Godard,Natalie Portman|Viola Davis|Christian Bale|Leonardo DiCaprio,Hindi,France,90,7.8,483946,301.3,1857.5,corruption|power|ambition|justice|redemption|based on true story,A biography film directed by Jean-Luc Godard featuring Natalie Portman.,63.4
MV1476,Mank: Nexus,1995,Action,Wes Anderson,Anya Taylor-Joy|Adam Driver|Joaquin Phoenix|Jessica Chastain,French,France,132,7.1,115864,50.4,301.3,war|family|coming of age|redemption|supernatural,A action film directed by Wes Anderson featuring Anya Taylor-Joy.,86.51
MV1477,Aftersun: Horizon,2001,Mystery|History|Animation,Christopher Nolan,Adam Driver|Robert De Niro|Anya Taylor-Joy|Al Pacino|Emma Stone,French,Japan,167,7.0,794363,91.5,258.0,mystery|survival|based on true story|dystopia|danger|conspiracy,A mystery film directed by Christopher Nolan featuring Adam Driver.,37.73
MV1478,The Green Mile: Redemption,1988,History,Denis Villeneuve,Joaquin Phoenix|Timothée Chalamet|Tom Hardy,Spanish,Japan,179,5.1,453068,7.5,15.6,conspiracy|escape|identity|ambition|dystopia|heist,A history film directed by Denis Villeneuve featuring Joaquin Phoenix.,80.3
MV1479,The Revolution of Se7en,2021,Fantasy|Musical,Wong Kar-wai,Anya Taylor-Joy|Margot Robbie|Jessica Chastain,English,France,97,7.6,2044865,153.9,385.1,friendship|redemption|love|power|based on true story|corruption,A fantasy film directed by Wong Kar-wai featuring Anya Taylor-Joy.,6.79
MV1480,The Menu: Fallen,2019,Sci-Fi|Musical,Alfonso Cuaron,Saoirse Ronan|Benedict Cumberbatch|Christian Bale,Korean,South Korea,109,6.9,644062,218.6,,revenge|family|corruption|loss,A sci-fi film directed by Alfonso Cuaron featuring Saoirse Ronan.,57.79
MV1481,The Eclipse of There,2008,Fantasy,Billy Wilder,Gene Hackman|Adam Driver|Timothée Chalamet,Italian,USA,187,8.7,596567,271.8,1357.5,coming of age|dystopia|corruption|mystery|supernatural,A fantasy film directed by Billy Wilder featuring Gene Hackman.,6.61
MV1482,The Infinity of Joker,2017,Biography|Romance|Animation,Ridley Scott,Tom Hanks|Emma Stone|Margot Robbie,Spanish,USA,107,7.0,1923889,24.8,193.1,survival|freedom|conspiracy,A biography film directed by Ridley Scott featuring Tom Hanks.,17.14
MV1483,The Fallen of Women,2006,Mystery|Adventure,Clint Eastwood,Natalie Portman|Florence Pugh|Jack Nicholson|Dustin Hoffman|Zendaya,Italian,Japan,180,4.6,768040,324.1,222.1,time travel|danger|mystery|freedom|family,A mystery film directed by Clint Eastwood featuring Natalie Portman.,79.07
MV1484,The Green Mile: Horizon,1982,Biography|Fantasy|Horror,Guillermo del Toro,Paul Mescal|Tom Hardy|Idris Elba|Ana de Armas,Spanish,South Korea,199,5.4,787962,158.5,986.6,based on true story|betrayal|war,A biography film directed by Guillermo del Toro featuring Paul Mescal.,13.87
MV1485,Mank: Fallen,2024,Sci-Fi|Biography|Fantasy,Francis Ford Coppola,Gene Hackman|Cate Blanchett|Timothée Chalamet,English,India,149,7.8,946963,209.8,632.4,conspiracy|justice|betrayal|discovery|corruption,A sci-fi film directed by Francis Ford Coppola featuring Gene Hackman.,73.79
MV1486,A Beautiful Mind: Rising,1996,Thriller,Sofia Coppola,Amy Adams|Christian Bale|Tom Hanks|Mark Ruffalo,Japanese,France,111,4.6,739816,132.5,366.7,escape|time travel|loss|redemption|supernatural,A thriller film directed by Sofia Coppola featuring Amy Adams.,73.86
MV1487,Mank: Void,1981,Adventure|History,Ang Lee,Ana de Armas|Denzel Washington|Daniel Craig|Benedict Cumberbatch,English,Japan,193,4.1,698135,4.6,14.6,coming of age|ambition|heist|justice|survival|discovery,A adventure film directed by Ang Lee featuring Ana de Armas.,76.84
MV1488,The Worst Person in the World: Returns,2007,Mystery|Thriller|Comedy,Wong Kar-wai,Jennifer Lawrence|Lupita Nyong'o|Ryan Gosling|Margot Robbie|Amy Adams,Hindi,India,196,5.8,716113,56.8,173.9,revenge|identity|survival|loss,A mystery film directed by Wong Kar-wai featuring Jennifer Lawrence.,35.58
MV1489,The Worst Person in the World: Redemption,1989,Romance|Drama|History,Alfonso Cuaron,Emma Stone|Meryl Streep|Morgan Freeman|Daniel Craig,Italian,Italy,177,5.3,1025935,162.7,951.1,time travel|identity|betrayal|dystopia,A romance film directed by Alfonso Cuaron featuring Emma Stone.,62.62
MV1490,Braveheart: Prophecy,2019,Action|Mystery|History,Sofia Coppola,Natalie Portman|Jake Gyllenhaal|Emma Stone|Ryan Gosling,Mandarin,USA,86,5.5,2242573,298.2,604.8,survival|dystopia|time travel|betrayal,A action film directed by Sofia Coppola featuring Natalie Portman.,85.2
MV1491,Se7en: Nexus,1987,Horror|Adventure|Comedy,Jean-Luc Godard,Paul Mescal|Lupita Nyong'o|Zendaya|Michael Fassbender,Japanese,USA,101,8.2,461263,,431.9,loss|power|coming of age,A horror film directed by Jean-Luc Godard featuring Paul Mescal.,14.22
MV1492,Memoria: Nexus,2011,Mystery|Adventure,Ron Howard,Jennifer Lawrence|Austin Butler|Jessica Chastain,German,Japan,177,8.1,499081,208.9,1227.6,power|heist|betrayal|war,A mystery film directed by Ron Howard featuring Jennifer Lawrence.,61.44
MV1493,The Phantom of Fight,1984,Romance,Ridley Scott,Idris Elba|Paul Mescal|Emma Stone|Matt Damon|Tom Hardy,Hindi,Australia,103,4.5,1873813,54.5,335.4,escape|conspiracy|ambition|war|time travel,A romance film directed by Ridley Scott featuring Idris Elba.,16.93
MV1494,The Phantom of Dune,1981,Fantasy|Musical|Comedy,Billy Wilder,Brad Pitt|Leonardo DiCaprio|Charlize Theron,Korean,France,161,,1662068,66.8,69.6,time travel|love|corruption|based on true story|betrayal,A fantasy film directed by Billy Wilder featuring Brad Pitt.,27.75
MV1495,The Destiny of Whiplash,2006,Comedy|Mystery|Biography,Kathryn Bigelow,Brad Pitt|Saoirse Ronan|Michael Fassbender|Paul Mescal|Adam Driver,Spanish,India,186,9.1,953687,62.9,288.1,ambition|discovery|loss|heist,A comedy film directed by Kathryn Bigelow featuring Brad Pitt.,79.17
MV1496,The Unleashed of 1917,1987,Adventure|Biography|History,Federico Fellini,Amy Adams|Michael Fassbender|Timothée Chalamet|Natalie Portman,Korean,Germany,153,9.3,456753,1.3,1.1,heist|ambition|based on true story|betrayal,A adventure film directed by Federico Fellini featuring Amy Adams.,20.91
MV1497,Everything Everywhere All at Once: Uprising,2002,Animation,John Ford,Cate Blanchett|Austin Butler|Florence Pugh|Jennifer Lawrence|Tom Hanks,German,India,201,6.1,183237,148.4,763.4,dystopia|escape|betrayal|revenge|time travel,A animation film directed by John Ford featuring Cate Blanchett.,89.99
MV1498,Whiplash: Shadows,2009,Animation|Sci-Fi|Drama,Clint Eastwood,Matt Damon|Charlize Theron|Daniel Craig|Lupita Nyong'o|Paul Mescal,Korean,Australia,151,5.9,2087576,63.2,347.7,conspiracy|loss|justice|dystopia,A animation film directed by Clint Eastwood featuring Matt Damon.,40.53
MV1499,Glass Onion: Order,1993,Crime|Adventure,Kathryn Bigelow,Christian Bale|Benedict Cumberbatch|Jennifer Lawrence|Ryan Gosling|Denzel Washington,Japanese,Germany,77,8.2,1250321,310.4,1477.8,freedom|friendship|time travel,A crime film directed by Kathryn Bigelow featuring Christian Bale.,48.04
MV1500,The Banshees of Inisherin: Fallen,2019,Animation|Action,Sofia Coppola,Andrew Garfield|Denzel Washington|Timothée Chalamet,Japanese,India,140,7.1,2395857,100.2,242.9,based on true story|discovery|ambition|power,A animation film directed by Sofia Coppola featuring Andrew Garfield.,12.14
MV1501,The Chaos of No,2017,Biography|Adventure|Drama,Guillermo del Toro,Daniel Craig|Paul Mescal|Tom Hanks|Idris Elba,Japanese,Italy,77,8.4,700044,232.3,990.5,revenge|corruption|betrayal|war|love|coming of age,,40.45
MV1502,The Shawshank Redemption: Reborn,2014,Romance,Sofia Coppola,Charlize Theron|Austin Butler|Natalie Portman|Ryan Gosling,English,Australia,123,8.8,173591,116.1,307.6,discovery|supernatural|sacrifice|friendship,A romance film directed by Sofia Coppola featuring Charlize Theron.,83.51
MV1503,Braveheart: Void,2008,Musical|Action,Steven Spielberg,Emma Stone|Meryl Streep|Charlize Theron,German,Germany,101,7.3,1493714,226.1,97.9,loss|power|war|danger|friendship,A musical film directed by Steven Spielberg featuring Emma Stone.,76.96
MV1504,Belfast: Horizon,2016,Adventure,Akira Kurosawa,Tom Hanks|Jack Nicholson|Matt Damon|Austin Butler,Hindi,France,181,8.8,147462,11.9,61.4,identity|justice|conspiracy|war,A adventure film directed by Akira Kurosawa featuring Tom Hanks.,5.71
MV1505,The Horizon of Everything,2005,Romance|Mystery,Alfonso Cuaron,Andrew Garfield|Michael Fassbender|Mark Ruffalo|Christian Bale,Japanese,USA,171,4.8,529675,41.8,305.5,sacrifice|family|corruption|identity|betrayal|conspiracy,A romance film directed by Alfonso Cuaron featuring Andrew Garfield.,93.96
MV1506,The Chronicles of Uncut,2008,Romance,Ron Howard,Florence Pugh|Jessica Chastain|Joaquin Phoenix|Paul Mescal,Japanese,Italy,170,7.3,1834218,114.9,119.7,danger|mystery|corruption|revenge,A romance film directed by Ron Howard featuring Florence Pugh.,49.42
MV1507,Belfast: Destiny,2018,Action,John Ford,Michael Fassbender|Scarlett Johansson|Gene Hackman,Spanish,UK,92,9.1,1981975,83.7,527.0,time travel|freedom|sacrifice|betrayal,A action film directed by John Ford featuring Michael Fassbender.,43.13
MV1508,Judas and the Black Messiah: Horizon,2000,Horror|Comedy|History,Kathryn Bigelow,Joaquin Phoenix|Christian Bale|Charlize Theron|Scarlett Johansson|Jennifer Lawrence,French,Germany,104,9.4,1375438,171.7,864.5,survival|love|corruption|based on true story|ambition|time travel,A horror film directed by Kathryn Bigelow featuring Joaquin Phoenix.,5.67
MV1509,Whiplash: Chronicles,2020,Horror,Akira Kurosawa,Joaquin Phoenix|Saoirse Ronan|Austin Butler,Japanese,UK,193,4.7,2436133,105.8,688.2,redemption|friendship|power|discovery|dystopia|love,A horror film directed by Akira Kurosawa featuring Joaquin Phoenix.,34.0
MV1510,The Irishman: Rising,1984,Thriller|Musical|Mystery,Ang Lee,Amy Adams|Adam Driver|Meryl Streep|Ana de Armas|Florence Pugh,Mandarin,Australia,119,8.5,2336457,24.8,159.1,danger|sacrifice|redemption|revenge|power|dystopia,A thriller film directed by Ang Lee featuring Amy Adams.,44.04
MV1511,Tenet: Untold,2022,Musical,Alfonso Cuaron,Ryan Gosling|Florence Pugh|Ana de Armas|Brad Pitt|Natalie Portman,Mandarin,Canada,102,6.0,2007413,66.6,163.2,sacrifice|survival|supernatural|dystopia|freedom|loss,A musical film directed by Alfonso Cuaron featuring Ryan Gosling.,93.42
MV1512,Tár: Revolution,1988,Crime|Musical|Romance,Wong Kar-wai,Dustin Hoffman|Adam Driver|Idris Elba|Benedict Cumberbatch,English,Canada,82,7.8,471456,17.8,87.0,sacrifice|mystery|escape|revenge|danger,A crime film directed by Wong Kar-wai featuring Dustin Hoffman.,90.69
MV1513,The Phantom of Black,2022,Romance|Musical|Comedy,Stanley Kubrick,Jessica Chastain|Margot Robbie|Ana de Armas|Austin Butler,Japanese,Canada,192,7.2,1838274,60.6,443.2,dystopia|coming of age|sacrifice|corruption|time travel,A romance film directed by Stanley Kubrick featuring Jessica Chastain.,71.29
MV1514,Fight Club: Returns,1989,Animation,John Ford,Timothée Chalamet|Paul Mescal|Denzel Washington|Gene Hackman|Dustin Hoffman,French,France,151,6.9,787563,224.1,1632.8,survival|freedom|revenge|corruption|escape|ambition,A animation film directed by John Ford featuring Timothée Chalamet.,30.63
MV1515,The Redemption of Black,2011,Adventure,Guillermo del Toro,Natalie Portman|Robert De Niro|Amy Adams|Emma Stone|Dustin Hoffman,English,South Korea,210,6.8,1823078,297.3,350.3,escape|mystery|discovery,A adventure film directed by Guillermo del Toro featuring Natalie Portman.,98.62
MV1516,The Green Mile: Spark,1981,Biography|Crime|Mystery,Jean-Luc Godard,Anya Taylor-Joy|Dustin Hoffman|Christian Bale|Natalie Portman|Saoirse Ronan,Hindi,Canada,87,6.0,620947,196.5,702.3,escape|redemption|mystery|justice|survival|time travel,A biography film directed by Jean-Luc Godard featuring Anya Taylor-Joy.,83.08
MV1517,The Revolution of Birdman,2022,Thriller|Comedy,Woody Allen,Tom Hanks|Matt Damon|Anya Taylor-Joy|Viola Davis,French,USA,138,9.3,2235046,44.9,211.7,power|family|time travel|corruption|justice|war,A thriller film directed by Woody Allen featuring Tom Hanks.,25.09
MV1518,The Worst Person in the World: Infinity,2012,Drama|Action|Romance,Alfonso Cuaron,Scarlett Johansson|Joaquin Phoenix|Emma Stone,Hindi,South Korea,177,4.4,1440699,326.5,2096.8,redemption|loss|coming of age|based on true story|family|freedom,A drama film directed by Alfonso Cuaron featuring Scarlett Johansson.,8.81
MV1519,1917: Eclipse,2019,Fantasy,Christopher Nolan,Benedict Cumberbatch|Paul Mescal|Jennifer Lawrence|Adam Driver|Robert De Niro,Italian,Japan,190,7.7,361492,228.1,1580.3,mystery|escape|sacrifice|based on true story|betrayal|justice,A fantasy film directed by Christopher Nolan featuring Benedict Cumberbatch.,35.33
MV1520,The Spark of Goodfellas,1988,Musical|Thriller|Animation,Ron Howard,Timothée Chalamet|Tom Hanks|Christian Bale,Mandarin,Canada,182,9.5,1587329,144.0,423.6,power|betrayal|ambition|survival,A musical film directed by Ron Howard featuring Timothée Chalamet.,38.39
MV1521,The Awakening of 1917,2024,Horror|Mystery,Wong Kar-wai,Benedict Cumberbatch|Paul Mescal|Dustin Hoffman,Japanese,Germany,142,4.2,1566754,337.2,198.5,family|sacrifice|redemption,A horror film directed by Wong Kar-wai featuring Benedict Cumberbatch.,1.82
MV1522,The Beyond of Whiplash,2020,Mystery|Romance,Clint Eastwood,Austin Butler|Daniel Craig|Ryan Gosling,Italian,South Korea,80,7.2,2413281,279.3,983.6,friendship|conspiracy|coming of age|heist|discovery|time travel,A mystery film directed by Clint Eastwood featuring Austin Butler.,96.55
MV1523,Belfast: Reckoning,2012,Biography|Romance,Jean-Luc Godard,Charlize Theron|Matt Damon|Viola Davis|Benedict Cumberbatch,Mandarin,India,109,8.7,518098,159.3,1137.3,time travel|identity|based on true story,A biography film directed by Jean-Luc Godard featuring Charlize Theron.,55.73
MV1524,American Beauty: Beyond,1982,Romance,David Fincher,Ana de Armas|Austin Butler|Cate Blanchett|Zendaya|Emma Stone,,India,,,1507360,336.7,677.7,redemption|loss|power|coming of age,A romance film directed by David Fincher featuring Ana de Armas.,48.01
MV1525,The Order of Women,2002,Adventure,Federico Fellini,Lupita Nyong'o|Tom Hanks|Amy Adams|Paul Mescal|Scarlett Johansson,,France,164,5.5,700856,339.5,2516.9,time travel|betrayal|mystery,A adventure film directed by Federico Fellini featuring Lupita Nyong'o.,89.55
MV1526,Spencer: Beyond,1984,Action,Billy Wilder,Zendaya|Daniel Craig|Margot Robbie|Natalie Portman|Anya Taylor-Joy,Korean,France,144,6.0,1008463,294.2,1545.4,discovery|sacrifice|conspiracy,A action film directed by Billy Wilder featuring Zendaya.,62.0
MV1527,The Rising of Minari,2017,Fantasy|Adventure|Animation,James Cameron,Jessica Chastain|Idris Elba|Anya Taylor-Joy|Lupita Nyong'o|Emma Stone,Spanish,France,170,4.4,2081412,294.9,1890.2,power|revenge|friendship|dystopia,A fantasy film directed by James Cameron featuring Jessica Chastain.,89.12
MV1528,No Country for Old Men: Origins,1992,Sci-Fi|Adventure,Tim Burton,Jessica Chastain|Emma Stone|Brad Pitt,Hindi,USA,113,7.0,1882777,243.4,391.3,coming of age|love|discovery|corruption,A sci-fi film directed by Tim Burton featuring Jessica Chastain.,78.16
MV1529,The Eclipse of Everything,2014,Action|Musical|Horror,Clint Eastwood,Denzel Washington|Jennifer Lawrence|Tom Hanks|Brad Pitt,French,India,137,4.8,2362753,338.0,169.1,redemption|discovery|freedom|survival|dystopia|love,A action film directed by Clint Eastwood featuring Denzel Washington.,65.78
MV1530,Judas and the Black Messiah: Beyond,2010,Mystery,Guillermo del Toro,Morgan Freeman|Amy Adams|Matt Damon|Tom Hanks,Japanese,Italy,146,8.1,470236,349.6,403.6,danger|based on true story|survival|sacrifice,A mystery film directed by Guillermo del Toro featuring Morgan Freeman.,83.59
MV1531,Braveheart: Untold,1999,History|Biography,Wong Kar-wai,Amy Adams|Mark Ruffalo|Morgan Freeman,French,Germany,78,4.8,760520,75.9,366.2,family|supernatural|heist,A history film directed by Wong Kar-wai featuring Amy Adams.,73.31
MV1532,American Beauty: Void,2019,Thriller,Woody Allen,Lupita Nyong'o|Jack Nicholson|Dustin Hoffman,Italian,Italy,99,5.2,548566,165.1,149.8,discovery|power|supernatural|danger|revenge|heist,A thriller film directed by Woody Allen featuring Lupita Nyong'o.,14.26
MV1533,The Uprising of Fight,1986,Crime,Woody Allen,Jennifer Lawrence|Paul Mescal|Daniel Craig,French,France,185,,1698029,347.7,1986.8,friendship|sacrifice|danger|identity|ambition|heist,A crime film directed by Woody Allen featuring Jennifer Lawrence.,42.71
MV1534,Saving Private Ryan: Chronicles,1996,Adventure,John Ford,Saoirse Ronan|Gene Hackman|Andrew Garfield,French,Canada,103,7.1,2059126,102.8,700.8,survival|identity|power|love,A adventure film directed by John Ford featuring Saoirse Ronan.,5.98
MV1535,The Reborn of The,2005,Fantasy|Mystery|Comedy,Federico Fellini,Jennifer Lawrence|Ryan Gosling|Margot Robbie,Mandarin,Japan,205,,1884441,330.6,198.6,war|mystery|escape|ambition,A fantasy film directed by Federico Fellini featuring Jennifer Lawrence.,41.61
MV1536,The Chaos of Everything,2011,Fantasy|Comedy|Action,Bong Joon-ho,Leonardo DiCaprio|Emma Stone|Brad Pitt|Tom Hanks,English,Australia,207,6.1,1224439,260.6,2072.9,mystery|escape|war|discovery|revenge|conspiracy,A fantasy film directed by Bong Joon-ho featuring Leonardo DiCaprio.,52.1
MV1537,Pulp Fiction: Reborn,1981,History|Musical|Drama,Guillermo del Toro,Dustin Hoffman|Morgan Freeman|Viola Davis|Scarlett Johansson|Zendaya,Korean,India,192,8.1,188608,136.5,610.4,power|danger|dystopia|survival|identity,A history film directed by Guillermo del Toro featuring Dustin Hoffman.,48.52
MV1538,Knives Out: Chronicles,2012,Mystery|Thriller,Denis Villeneuve,Matt Damon|Natalie Portman|Viola Davis|Saoirse Ronan,French,UK,208,8.9,1336217,33.3,164.9,conspiracy|friendship|corruption|ambition|family,A mystery film directed by Denis Villeneuve featuring Matt Damon.,76.16
MV1539,The Irishman: Revolution,1980,Horror,David Fincher,Viola Davis|Margot Robbie|Lupita Nyong'o|Tom Hanks,Hindi,Italy,171,9.2,1051181,99.9,715.0,loss|identity|freedom|family|conspiracy,A horror film directed by David Fincher featuring Viola Davis.,6.31
MV1540,The Eclipse of Little,2014,Fantasy,Ang Lee,Scarlett Johansson|Jack Nicholson|Ryan Gosling,Mandarin,India,148,9.3,627175,336.4,1113.9,ambition|justice|survival,A fantasy film directed by Ang Lee featuring Scarlett Johansson.,50.19
MV1541,Little Women: Origins,2006,Comedy|Thriller,Bong Joon-ho,Tom Hanks|Leonardo DiCaprio|Tom Hardy|Robert De Niro,Spanish,Canada,99,,2349867,332.7,1513.0,war|danger|heist|identity|survival,A comedy film directed by Bong Joon-ho featuring Tom Hanks.,63.21
MV1542,Interstellar: Destiny,1987,Action,Clint Eastwood,Amy Adams|Ryan Gosling|Brad Pitt|Idris Elba|Adam Driver,German,USA,88,4.5,2356343,85.6,120.1,revenge|survival|supernatural,A action film directed by Clint Eastwood featuring Amy Adams.,88.02
MV1543,Aftersun: Nexus,1984,Drama|Comedy,Christopher Nolan,Idris Elba|Paul Mescal|Mark Ruffalo|Leonardo DiCaprio|Zendaya,German,Germany,158,5.2,1085432,109.9,646.8,time travel|betrayal|family|freedom|identity,A drama film directed by Christopher Nolan featuring Idris Elba.,98.77
MV1544,Pulp Fiction: Redemption,1980,Animation|Fantasy,John Ford,Emma Stone|Joaquin Phoenix|Zendaya|Morgan Freeman|Idris Elba,Korean,Italy,182,,1719961,187.6,292.0,coming of age|war|supernatural|heist|family,A animation film directed by John Ford featuring Emma Stone.,82.78
MV1545,The Nexus of Joker,2004,Musical|Fantasy,Ingmar Bergman,Morgan Freeman|Scarlett Johansson|Margot Robbie|Cate Blanchett,Hindi,Germany,188,6.8,1131627,276.7,708.2,dystopia|survival|heist|betrayal|escape|love,A musical film directed by Ingmar Bergman featuring Morgan Freeman.,64.27
MV1546,The Reign of CODA,2010,Comedy|Musical,Denis Villeneuve,Margot Robbie|Emma Stone|Joaquin Phoenix|Brad Pitt,Japanese,Germany,171,7.0,464314,53.6,154.9,dystopia|friendship|discovery|supernatural|justice|betrayal,A comedy film directed by Denis Villeneuve featuring Margot Robbie.,36.33
MV1547,Promising Young Woman: Phantom,1985,Drama,Woody Allen,Al Pacino|Zendaya|Jake Gyllenhaal|Paul Mescal|Andrew Garfield,French,Australia,112,6.5,11575,300.2,1081.8,mystery|corruption|heist|escape|based on true story,A drama film directed by Woody Allen featuring Al Pacino.,29.46
MV1548,The Untold of CODA,2006,Action|Sci-Fi|History,Peter Jackson,Charlize Theron|Natalie Portman|Meryl Streep,Spanish,UK,116,8.5,1557380,109.5,586.4,survival|based on true story|supernatural|betrayal|mystery,,86.46
MV1549,The Shadows of Minari,1995,Comedy|Drama,Billy Wilder,Jack Nicholson|Ana de Armas|Jessica Chastain|Brad Pitt|Jake Gyllenhaal,Spanish,USA,,4.6,1874687,193.2,939.0,survival|based on true story|friendship,A comedy film directed by Billy Wilder featuring Jack Nicholson.,4.21
MV1550,The Infinity of Everything,2011,Drama|Crime|Animation,Akira Kurosawa,Andrew Garfield|Lupita Nyong'o|Meryl Streep|Natalie Portman|Dustin Hoffman,German,France,165,7.8,214609,252.9,579.0,time travel|freedom|dystopia|ambition|corruption,A drama film directed by Akira Kurosawa featuring Andrew Garfield.,86.87
MV1551,The Power of the Dog: Phantom,1990,Drama|Action|Animation,Ridley Scott,Austin Butler|Saoirse Ronan|Leonardo DiCaprio|Florence Pugh|Scarlett Johansson,Hindi,Canada,89,7.9,1963717,40.1,140.3,revenge|danger|conspiracy|ambition|war|discovery,A drama film directed by Ridley Scott featuring Austin Butler.,47.53
MV1552,Tenet: Destiny,2004,Animation|Musical,Akira Kurosawa,Paul Mescal|Jake Gyllenhaal|Zendaya,Italian,South Korea,85,6.5,1759358,196.3,219.2,betrayal|based on true story|power,A animation film directed by Akira Kurosawa featuring Paul Mescal.,55.16
MV1553,Joker: Revolution,1980,Mystery,Peter Jackson,Tom Hardy|Jake Gyllenhaal|Scarlett Johansson|Emma Stone|Michael Fassbender,Spanish,France,106,6.1,160599,276.5,901.5,danger|justice|freedom|friendship|loss|heist,A mystery film directed by Peter Jackson featuring Tom Hardy.,47.74
MV1554,1917: Untold,2016,Fantasy|Musical,Wong Kar-wai,Robert De Niro|Jennifer Lawrence|Brad Pitt,French,Germany,151,8.5,1630047,26.4,105.6,redemption|justice|love,A fantasy film directed by Wong Kar-wai featuring Robert De Niro.,97.94
MV1555,Parasite: Dominion,2024,Fantasy|Drama|Crime,Sofia Coppola,Anya Taylor-Joy|Scarlett Johansson|Tom Hardy,Mandarin,Japan,203,4.4,99923,4.6,33.7,discovery|based on true story|survival|revenge|corruption|mystery,A fantasy film directed by Sofia Coppola featuring Anya Taylor-Joy.,5.64
MV1556,Se7en: Reckoning,2004,Romance|Sci-Fi|Fantasy,Ingmar Bergman,Ryan Gosling|Gene Hackman|Al Pacino,Italian,South Korea,154,7.0,393051,2.1,0.9,coming of age|friendship|sacrifice,A romance film directed by Ingmar Bergman featuring Ryan Gosling.,42.64
MV1557,The Order of Forrest,1987,Animation|Thriller,Sofia Coppola,Jennifer Lawrence|Matt Damon|Scarlett Johansson|Paul Mescal,French,India,201,5.8,414057,47.8,232.3,ambition|war|corruption|justice|friendship|family,A animation film directed by Sofia Coppola featuring Jennifer Lawrence.,38.26
MV1558,Joker: Chronicles,1981,Romance,Ingmar Bergman,Adam Driver|Mark Ruffalo|Margot Robbie|Timothée Chalamet,Hindi,France,84,6.0,1852965,36.5,140.4,dystopia|ambition|freedom,A romance film directed by Ingmar Bergman featuring Adam Driver.,13.13
MV1559,The Chaos of Whiplash,2022,Action|Thriller|Drama,Ron Howard,Joaquin Phoenix|Ryan Gosling|Austin Butler|Tom Hanks,Spanish,India,150,8.5,1266480,176.6,494.0,heist|betrayal|loss|love|based on true story|escape,A action film directed by Ron Howard featuring Joaquin Phoenix.,18.1
